{
  "id": "seamo_x_2026_c",
  "name": "SEAMO X 2026 \u2014 Papers C-F",
  "brand": "seamo_x",
  "year": 2026,
  "paper": "C",
  "reference_dpi": 300,
  "page_size": {
    "width": 2482,
    "height": 3510
  },
  "anchor": {
    "x": 97,
    "y": 853,
    "w": 2287,
    "h": 69,
    "min_match_score": 0.45
  },
  "detection": {
    "filename_pattern": "SEAMO.*X.*2026|ZONE.*Z",
    "text_markers": [
      "SEAMO X",
      "2026",
      "Paper C"
    ]
  },
  "header": {
    "region": {
      "x": 97,
      "y": 200,
      "w": 2287,
      "h": 650
    },
    "fields": [
      {
        "key": "candidate_name",
        "label": "Candidate Name",
        "type": "text_line"
      },
      {
        "key": "candidate_number",
        "label": "Candidate No.",
        "type": "grid_boxes",
        "prefix": "CAN",
        "max_length": 12
      }
    ]
  },
  "sections": [
    {
      "type": "open_response",
      "questions": {
        "start": 1,
        "end": 15
      },
      "region": {
        "x": 91,
        "y": 1325,
        "w": 2300,
        "h": 1425
      },
      "grid": {
        "rows": 15,
        "cols": 3,
        "questions_per_col": [
          5,
          5,
          5
        ],
        "cell_width": 720,
        "cell_height": 163,
        "row_positions": [
          1446,
          1719,
          1992,
          2265,
          2538,
          1446,
          1719,
          1992,
          2265,
          2538,
          1446,
          1719,
          1992,
          2265,
          2538
        ],
        "row_pitch": 200.0
      },
      "extraction_strategy": "llm"
    }
  ]
}
